{
  "schemaVersion": 1,
  "catalogId": "r5-gps-owner-serial-core",
  "revision": 1,
  "observedOn": "2026-10-15",
  "status": "proposal-only",
  "entries": [
    {
      "id": "R5P-001",
      "category": "gps",
      "label": "GPSLatitudeRef",
      "selector": {
        "kind": "native",
        "namespace": "tiff-gps",
        "nativeId": "0x0001",
        "locations": [
          "cr3.cmt4.gps",
          "preview.exif.gps"
        ]
      },
      "sourceRefs": [
        "SRC-GPS",
        "SRC-CR3-LOCATIONS"
      ],
      "occurrenceRule": "every-exact-property-occurrence",
      "fixtureFamilies": [
        "FXP-006",
        "FXP-019",
        "FXP-024"
      ]
    },
    {
      "id": "R5P-002",
      "category": "gps",
      "label": "GPSLatitude",
      "selector": {
        "kind": "native",
        "namespace": "tiff-gps",
        "nativeId": "0x0002",
        "locations": [
          "cr3.cmt4.gps",
          "preview.exif.gps"
        ]
      },
      "sourceRefs": [
        "SRC-GPS",
        "SRC-CR3-LOCATIONS"
      ],
      "occurrenceRule": "every-exact-property-occurrence",
      "fixtureFamilies": [
        "FXP-006",
        "FXP-019",
        "FXP-024"
      ]
    },
    {
      "id": "R5P-003",
      "category": "gps",
      "label": "GPSLongitudeRef",
      "selector": {
        "kind": "native",
        "namespace": "tiff-gps",
        "nativeId": "0x0003",
        "locations": [
          "cr3.cmt4.gps",
          "preview.exif.gps"
        ]
      },
      "sourceRefs": [
        "SRC-GPS",
        "SRC-CR3-LOCATIONS"
      ],
      "occurrenceRule": "every-exact-property-occurrence",
      "fixtureFamilies": [
        "FXP-006",
        "FXP-019",
        "FXP-024"
      ]
    },
    {
      "id": "R5P-004",
      "category": "gps",
      "label": "GPSLongitude",
      "selector": {
        "kind": "native",
        "namespace": "tiff-gps",
        "nativeId": "0x0004",
        "locations": [
          "cr3.cmt4.gps",
          "preview.exif.gps"
        ]
      },
      "sourceRefs": [
        "SRC-GPS",
        "SRC-CR3-LOCATIONS"
      ],
      "occurrenceRule": "every-exact-property-occurrence",
      "fixtureFamilies": [
        "FXP-006",
        "FXP-019",
        "FXP-024"
      ]
    },
    {
      "id": "R5P-005",
      "category": "gps",
      "label": "GPSAltitudeRef",
      "selector": {
        "kind": "native",
        "namespace": "tiff-gps",
        "nativeId": "0x0005",
        "locations": [
          "cr3.cmt4.gps",
          "preview.exif.gps"
        ]
      },
      "sourceRefs": [
        "SRC-GPS",
        "SRC-CR3-LOCATIONS"
      ],
      "occurrenceRule": "every-exact-property-occurrence",
      "fixtureFamilies": [
        "FXP-006",
        "FXP-019",
        "FXP-024"
      ]
    },
    {
      "id": "R5P-006",
      "category": "gps",
      "label": "GPSAltitude",
      "selector": {
        "kind": "native",
        "namespace": "tiff-gps",
        "nativeId": "0x0006",
        "locations": [
          "cr3.cmt4.gps",
          "preview.exif.gps"
        ]
      },
      "sourceRefs": [
        "SRC-GPS",
        "SRC-CR3-LOCATIONS"
      ],
      "occurrenceRule": "every-exact-property-occurrence",
      "fixtureFamilies": [
        "FXP-006",
        "FXP-019",
        "FXP-024"
      ]
    },
    {
      "id": "R5P-007",
      "category": "gps",
      "label": "GPSTimeStamp",
      "selector": {
        "kind": "native",
        "namespace": "tiff-gps",
        "nativeId": "0x0007",
        "locations": [
          "cr3.cmt4.gps",
          "preview.exif.gps"
        ]
      },
      "sourceRefs": [
        "SRC-GPS",
        "SRC-CR3-LOCATIONS"
      ],
      "occurrenceRule": "every-exact-property-occurrence",
      "fixtureFamilies": [
        "FXP-006",
        "FXP-019",
        "FXP-024"
      ]
    },
    {
      "id": "R5P-008",
      "category": "gps",
      "label": "GPSDestLatitudeRef",
      "selector": {
        "kind": "native",
        "namespace": "tiff-gps",
        "nativeId": "0x0013",
        "locations": [
          "cr3.cmt4.gps",
          "preview.exif.gps"
        ]
      },
      "sourceRefs": [
        "SRC-GPS",
        "SRC-CR3-LOCATIONS"
      ],
      "occurrenceRule": "every-exact-property-occurrence",
      "fixtureFamilies": [
        "FXP-006",
        "FXP-019",
        "FXP-024"
      ]
    },
    {
      "id": "R5P-009",
      "category": "gps",
      "label": "GPSDestLatitude",
      "selector": {
        "kind": "native",
        "namespace": "tiff-gps",
        "nativeId": "0x0014",
        "locations": [
          "cr3.cmt4.gps",
          "preview.exif.gps"
        ]
      },
      "sourceRefs": [
        "SRC-GPS",
        "SRC-CR3-LOCATIONS"
      ],
      "occurrenceRule": "every-exact-property-occurrence",
      "fixtureFamilies": [
        "FXP-006",
        "FXP-019",
        "FXP-024"
      ]
    },
    {
      "id": "R5P-010",
      "category": "gps",
      "label": "GPSDestLongitudeRef",
      "selector": {
        "kind": "native",
        "namespace": "tiff-gps",
        "nativeId": "0x0015",
        "locations": [
          "cr3.cmt4.gps",
          "preview.exif.gps"
        ]
      },
      "sourceRefs": [
        "SRC-GPS",
        "SRC-CR3-LOCATIONS"
      ],
      "occurrenceRule": "every-exact-property-occurrence",
      "fixtureFamilies": [
        "FXP-006",
        "FXP-019",
        "FXP-024"
      ]
    },
    {
      "id": "R5P-011",
      "category": "gps",
      "label": "GPSDestLongitude",
      "selector": {
        "kind": "native",
        "namespace": "tiff-gps",
        "nativeId": "0x0016",
        "locations": [
          "cr3.cmt4.gps",
          "preview.exif.gps"
        ]
      },
      "sourceRefs": [
        "SRC-GPS",
        "SRC-CR3-LOCATIONS"
      ],
      "occurrenceRule": "every-exact-property-occurrence",
      "fixtureFamilies": [
        "FXP-006",
        "FXP-019",
        "FXP-024"
      ]
    },
    {
      "id": "R5P-012",
      "category": "gps",
      "label": "GPSDateStamp",
      "selector": {
        "kind": "native",
        "namespace": "tiff-gps",
        "nativeId": "0x001d",
        "locations": [
          "cr3.cmt4.gps",
          "preview.exif.gps"
        ]
      },
      "sourceRefs": [
        "SRC-GPS",
        "SRC-CR3-LOCATIONS"
      ],
      "occurrenceRule": "every-exact-property-occurrence",
      "fixtureFamilies": [
        "FXP-006",
        "FXP-019",
        "FXP-024"
      ]
    },
    {
      "id": "R5P-013",
      "category": "owner",
      "label": "CameraOwnerName",
      "selector": {
        "kind": "native",
        "namespace": "tiff-exif",
        "nativeId": "0xa430",
        "locations": [
          "cr3.cmt2.exif",
          "preview.exif.exif"
        ]
      },
      "sourceRefs": [
        "SRC-EXIF",
        "SRC-CIPA-2017",
        "SRC-CR3-LOCATIONS"
      ],
      "occurrenceRule": "every-exact-property-occurrence",
      "fixtureFamilies": [
        "FXP-024"
      ]
    },
    {
      "id": "R5P-014",
      "category": "serial",
      "label": "BodySerialNumber",
      "selector": {
        "kind": "native",
        "namespace": "tiff-exif",
        "nativeId": "0xa431",
        "locations": [
          "cr3.cmt2.exif",
          "preview.exif.exif"
        ]
      },
      "sourceRefs": [
        "SRC-EXIF",
        "SRC-CIPA-2017",
        "SRC-CR3-LOCATIONS"
      ],
      "occurrenceRule": "every-exact-property-occurrence",
      "fixtureFamilies": [
        "FXP-024"
      ]
    },
    {
      "id": "R5P-015",
      "category": "serial",
      "label": "LensSerialNumber",
      "selector": {
        "kind": "native",
        "namespace": "tiff-exif",
        "nativeId": "0xa435",
        "locations": [
          "cr3.cmt2.exif",
          "preview.exif.exif"
        ]
      },
      "sourceRefs": [
        "SRC-EXIF",
        "SRC-CIPA-2017",
        "SRC-CR3-LOCATIONS"
      ],
      "occurrenceRule": "every-exact-property-occurrence",
      "fixtureFamilies": [
        "FXP-024"
      ]
    },
    {
      "id": "R5P-016",
      "category": "owner",
      "label": "OwnerName",
      "selector": {
        "kind": "native",
        "namespace": "canon-main",
        "nativeId": "0x0009",
        "locations": [
          "cr3.cmt3.canon"
        ]
      },
      "sourceRefs": [
        "SRC-CANON",
        "SRC-CR3-LOCATIONS"
      ],
      "occurrenceRule": "every-exact-property-occurrence",
      "fixtureFamilies": [
        "FXP-021",
        "FXP-024"
      ]
    },
    {
      "id": "R5P-017",
      "category": "serial",
      "label": "SerialNumber",
      "selector": {
        "kind": "native",
        "namespace": "canon-main",
        "nativeId": "0x000c",
        "locations": [
          "cr3.cmt3.canon"
        ]
      },
      "sourceRefs": [
        "SRC-CANON",
        "SRC-CR3-LOCATIONS"
      ],
      "occurrenceRule": "every-exact-property-occurrence",
      "fixtureFamilies": [
        "FXP-021",
        "FXP-024"
      ]
    },
    {
      "id": "R5P-018",
      "category": "serial",
      "label": "InternalSerialNumber",
      "selector": {
        "kind": "native",
        "namespace": "canon-main",
        "nativeId": "0x0096",
        "locations": [
          "cr3.cmt3.canon"
        ]
      },
      "sourceRefs": [
        "SRC-CANON",
        "SRC-CR3-LOCATIONS"
      ],
      "occurrenceRule": "every-exact-property-occurrence",
      "fixtureFamilies": [
        "FXP-021",
        "FXP-024"
      ]
    },
    {
      "id": "R5P-019",
      "category": "gps",
      "label": "GPSLatitude",
      "selector": {
        "kind": "xmp",
        "namespaceUri": "http://ns.adobe.com/exif/1.0/",
        "localName": "GPSLatitude",
        "locations": [
          "sidecar.xmp",
          "preview.xmp"
        ]
      },
      "sourceRefs": [
        "SRC-XMP-GPS"
      ],
      "occurrenceRule": "every-exact-property-occurrence",
      "fixtureFamilies": [
        "FXP-016",